"yt-simple-endpoint href","style-scope","Account name","yt-simple-endpoint href 2","yt-core-attributed-string","style-scope 2","style-scope src"
"https://www.youtube.com/@a697ag","@a697ag","4 years ago","https://www.youtube.com/watch?v=rHjw7yxcIQQ&lc=UgxZJfSZlztJ43XLVMB4AaABAg","'Hangover Pie'
Genius!","49","https://yt3.ggpht.com/ytc/AIdro_k6n1gF_yuZ2hOQq7pmo7vNMEtTtUYSA_PTQB_aCvc=s88-c-k-c0x00ffffff-no-rj"
"https://www.youtube.com/@sanjanewmoonlife","@sanjanewmoonlife","4 years ago","https://www.youtube.com/watch?v=rHjw7yxcIQQ&lc=UgySvvM6fM9d6hNVTXF4AaABAg&pp=0gcJCSIANpG00pGi","Shame Dragon's, they love pies, but they're not interested to invest in pies.","","https://yt3.ggpht.com/ytc/AIdro_lc2BJlb7-YYBeXFIw2uXHruivBHaOeiq9LWCt4MxUX05ZZ=s88-c-k-c0x00ffffff-no-rj"
"https://www.youtube.com/@donjoe2661","@donjoe2661","4 years ago","https://www.youtube.com/watch?v=rHjw7yxcIQQ&lc=UgzEqIk1jMXTSGarRTd4AaABAg","This guy changes his character and voices as much as I change moods in a day","6","https://yt3.ggpht.com/ytc/AIdro_mRcQPttr087AHiLSRxdy-8r2yGl-V6zZ95Zi-_jg6ODlA=s88-c-k-c0x00ffffff-no-rj"
"https://www.youtube.com/@koushuTX","@koushuTX","4 years ago","https://www.youtube.com/watch?v=rHjw7yxcIQQ&lc=UgxfcB4i_3-t7lNNGFV4AaABAg","Jenny was out when she was born. 

Jenny: Exits the womb 
“IM OUT”","5",""
"https://www.youtube.com/@chrissymodo","@chrissymodo","4 years ago","https://www.youtube.com/watch?v=rHjw7yxcIQQ&lc=Ugz69yFYqUIzXyoz1fp4AaABAg","Jenny ate all the pies... She's OUT","4",""
"https://www.youtube.com/@samsherrington7423","@samsherrington7423","4 years ago","https://www.youtube.com/watch?v=rHjw7yxcIQQ&lc=UgzwfSXDfW5Um1g2X6p4AaABAg","If I hadn't lived in Sheffield for a few years I'd have needed a translator.","",""
"https://www.youtube.com/@mrbigruss666","@mrbigruss666","4 years ago","https://www.youtube.com/watch?v=rHjw7yxcIQQ&lc=Ugy3i30PxEOwABQWbm54AaABAg","They do look like a nice pie, hard to get one around here","2",""
"https://www.youtube.com/@TripleDDDD","@TripleDDDD","4 years ago","https://www.youtube.com/watch?v=rHjw7yxcIQQ&lc=UgzaGypDigcxsgvU1tV4AaABAg","I would suport this guy, even if i make 100% minus. What a character, wish him all the best with his pies and his healh.","1",""
"https://www.youtube.com/@Shaggycod","@Shaggycod","4 years ago","https://www.youtube.com/watch?v=rHjw7yxcIQQ&lc=Ugwz6DikhYPujlc46Ch4AaABAg","Meatfeast","1",""
"https://www.youtube.com/@scratchnoff7609","@scratchnoff7609","4 years ago","https://www.youtube.com/watch?v=rHjw7yxcIQQ&lc=UgxfkNZjwFeWo1LYKh14AaABAg","Peter is calling him rookie!?","5",""
"https://www.youtube.com/@m77ast","@m77ast","4 years ago","https://www.youtube.com/watch?v=rHjw7yxcIQQ&lc=UgwzwdlpOYJK_UXf6Nt4AaABAg&pp=0gcJCSIANpG00pGi","Wow his route to market lost him 5 dragon investors.","1",""
"https://www.youtube.com/@user-qh5zz7dy1h","@user-qh5zz7dy1h","2 years ago","https://www.youtube.com/watch?v=rHjw7yxcIQQ&lc=Ugzcjc3_5muYY0CiEjR4AaABAg&pp=0gcJCSIANpG00pGi","Subs ON:
- Rocky
- Turkey","",""
"https://www.youtube.com/@matt5347","@matt5347","4 years ago","https://www.youtube.com/watch?v=rHjw7yxcIQQ&lc=Ugx9fBLh9jtRAoW4uAB4AaABAg","Jenny: ""The pie tastes very nice and you have a good brand. And for that reason, I'm out""","1",""
"https://www.youtube.com/@Instinct.12","@Instinct.12","4 years ago","https://www.youtube.com/watch?v=rHjw7yxcIQQ&lc=UgwA1CZlA7sQSQetuap4AaABAg","I love this man to the core","",""
"https://www.youtube.com/@chrissymodo","@chrissymodo","4 years ago","https://www.youtube.com/watch?v=rHjw7yxcIQQ&lc=Ugz69yFYqUIzXyoz1fp4AaABAg","Jenny ate all the pies... She's OUT","4","https://yt3.ggpht.com/ytc/AIdro_lfyz0gNo62NIQwpPsEYUZtQLfMAboOV9R6TniAAC4=s88-c-k-c0x00ffffff-no-rj"
"https://www.youtube.com/@samsherrington7423","@samsherrington7423","4 years ago","https://www.youtube.com/watch?v=rHjw7yxcIQQ&lc=UgzwfSXDfW5Um1g2X6p4AaABAg","If I hadn't lived in Sheffield for a few years I'd have needed a translator.","","https://yt3.ggpht.com/ytc/AIdro_nE2K3pAG7a8QGLOSNfspW19DpyX_8XgowqSW2OvamQcxw=s88-c-k-c0x00ffffff-no-rj"
"https://www.youtube.com/@mrbigruss666","@mrbigruss666","4 years ago","https://www.youtube.com/watch?v=rHjw7yxcIQQ&lc=Ugy3i30PxEOwABQWbm54AaABAg","They do look like a nice pie, hard to get one around here","2","https://yt3.ggpht.com/ytc/AIdro_nrpQXFvq-8iVxceF5NcwPbwbe_8Sd6px18fD4u7gsv0A=s88-c-k-c0x00ffffff-no-rj"
"https://www.youtube.com/@TripleDDDD","@TripleDDDD","4 years ago","https://www.youtube.com/watch?v=rHjw7yxcIQQ&lc=UgzaGypDigcxsgvU1tV4AaABAg","I would suport this guy, even if i make 100% minus. What a character, wish him all the best with his pies and his healh.","1","https://yt3.ggpht.com/ytc/AIdro_kC9Xtj3sdUnn49be6GmFzC1J3dp16-Nx_briHXhtg=s88-c-k-c0x00ffffff-no-rj"
"https://www.youtube.com/@Shaggycod","@Shaggycod","4 years ago","https://www.youtube.com/watch?v=rHjw7yxcIQQ&lc=Ugwz6DikhYPujlc46Ch4AaABAg","Meatfeast","1","https://yt3.ggpht.com/zi2fxFa6cj_vHEXNsobju2AbUVms5w65z_QUdxmkxKUN9o95SfOVm1PIRY1Vb2YauAxnPLwX4g=s88-c-k-c0x00ffffff-no-rj"
"https://www.youtube.com/@scratchnoff7609","@scratchnoff7609","4 years ago","https://www.youtube.com/watch?v=rHjw7yxcIQQ&lc=UgxfkNZjwFeWo1LYKh14AaABAg","Peter is calling him rookie!?","5","https://yt3.ggpht.com/ytc/AIdro_nLQ9L_9jGwtRbJFKPZ6N2e01JAYDxpMHIbyMG-wmI=s88-c-k-c0x00ffffff-no-rj"
"https://www.youtube.com/@m77ast","@m77ast","4 years ago","https://www.youtube.com/watch?v=rHjw7yxcIQQ&lc=UgwzwdlpOYJK_UXf6Nt4AaABAg&pp=0gcJCSIANpG00pGi","Wow his route to market lost him 5 dragon investors.","1","https://yt3.ggpht.com/ytc/AIdro_nEhEHOmrFgHafE44m-IRELTKfm30KXvLSY4sPPC68=s88-c-k-c0x00ffffff-no-rj"
"https://www.youtube.com/@user-qh5zz7dy1h","@user-qh5zz7dy1h","2 years ago","https://www.youtube.com/watch?v=rHjw7yxcIQQ&lc=Ugzcjc3_5muYY0CiEjR4AaABAg&pp=0gcJCSIANpG00pGi","Subs ON:
- Rocky
- Turkey","","https://yt3.ggpht.com/ytc/AIdro_nfaS9vjq2Wu5GonnDUIOhRL2y6pnzLaoMqhU-6dfu7LLR1aLU8I2-k3XCvlqvcw0YKRQ=s88-c-k-c0x00ffffff-no-rj"
"https://www.youtube.com/@matt5347","@matt5347","4 years ago","https://www.youtube.com/watch?v=rHjw7yxcIQQ&lc=Ugx9fBLh9jtRAoW4uAB4AaABAg","Jenny: ""The pie tastes very nice and you have a good brand. And for that reason, I'm out""","1","https://yt3.ggpht.com/ytc/AIdro_lCcLaQxWcvI2EGO1Yx8JghVogwuIvweQtKO2WljVQO8Z9U-9WIqXep9b4I_4RwnbLfMQ=s88-c-k-c0x00ffffff-no-rj"
"https://www.youtube.com/@Instinct.12","@Instinct.12","4 years ago","https://www.youtube.com/watch?v=rHjw7yxcIQQ&lc=UgwA1CZlA7sQSQetuap4AaABAg","I love this man to the core","","https://yt3.ggpht.com/ytc/AIdro_nJ6DKRJATok17eaa4yVQr-qgWcbu2BRLG__1n42C6tjA=s88-c-k-c0x00ffffff-no-rj"
"https://www.youtube.com/@Ghost572","@Ghost572","4 years ago","https://www.youtube.com/watch?v=rHjw7yxcIQQ&lc=UgwcRcU9yqHzzUHovgt4AaABAg","I really want to buy one of those pies now, they look really nice.","","https://yt3.ggpht.com/hlqIz5Iqnd8os5XDnwojkb6wclHPGc-cZJMkD01Mzz0fBAc5AreO4KlU5aXN3t0hsDY7eOxd=s88-c-k-c0x00ffffff-no-rj"
"https://www.youtube.com/@iranicus","@iranicus","4 years ago (edited)","https://www.youtube.com/watch?v=rHjw7yxcIQQ&lc=UgxRXbqqhH7wu486p1F4AaABAg","As a fellow yorkie I support this endeavor :>","1","https://yt3.ggpht.com/ytc/AIdro_kpcL0TOC92fZHGDdQNQDK20XdaT772eRh7jopZqIhv8A=s88-c-k-c0x00ffffff-no-rj"
"https://www.youtube.com/@thealien_ali3382","@thealien_ali3382","4 years ago","https://www.youtube.com/watch?v=rHjw7yxcIQQ&lc=UgxHehxEOwfOjF23Hud4AaABAg","He pentrates his pies","","https://yt3.ggpht.com/1rWF-TTft2wni95Bg8895NWFcHSd-3SnCysDnSOQ-aCJcGSIS1I8S4sqQMMzSm7bmwlWE-Q7YEc=s88-c-k-c0x00ffffff-no-rj"
"https://www.youtube.com/@horatiohornblower741","@horatiohornblower741","4 years ago","https://www.youtube.com/watch?v=rHjw7yxcIQQ&lc=UgyuRoc6T8uertiWLJJ4AaABAg","The hovis fitted the opening speech","","https://yt3.ggpht.com/ytc/AIdro_lLb7JCuF0_nRYDT51uBeJ6hlJVV-9plt-5Wz4ek0eU=s88-c-k-c0x00ffffff-no-rj"
"https://www.youtube.com/@thavambase6907","@thavambase6907","4 years ago","https://www.youtube.com/watch?v=rHjw7yxcIQQ&lc=UgyS9wmkWRB2GoLg4zF4AaABAg","Other dragons: I love the pies but I dont want to get too full and it wouldn't be right to keep eating more after saying that I was out,
Jenny: @ .....","","https://yt3.ggpht.com/ytc/AIdro_lvOrYIeDn24IfZMjtacILcyJiaCPSmz80N8ody__Q=s88-c-k-c0x00ffffff-no-rj"
"https://www.youtube.com/@hicknopunk","@hicknopunk","4 years ago","https://www.youtube.com/watch?v=rHjw7yxcIQQ&lc=UgwfHCVu6FhzfBuSTot4AaABAg","I would have invested in him and I hate English pies.","","https://yt3.ggpht.com/ytc/AIdro_nH3KGFHvR-b9xnwDdwai-jQSxHrI-1CP1bi7LlaFyjfg=s88-c-k-c0x00ffffff-no-rj"
"https://www.youtube.com/@mohamadabdo5521","@mohamadabdo5521","4 years ago","https://www.youtube.com/watch?v=rHjw7yxcIQQ&lc=UgyU_CtmEfsNLjCrsv54AaABAg","Civ 5 background song?","1","https://yt3.ggpht.com/ytc/AIdro_nXCLW1pcLg3ryHDDUt4jitDQjDwCX3Bsa27mWm2dg=s88-c-k-c0x00ffffff-no-rj"
"https://www.youtube.com/@lylecann9265","@lylecann9265","4 years ago","https://www.youtube.com/watch?v=rHjw7yxcIQQ&lc=UgyzkPGrWLqHCIniOOZ4AaABAg","""All that's behind me,"" says the man with prostate cancer.
Too soon? Sorry! haha","1",""
"https://www.youtube.com/@Persian-Immortal","@Persian-Immortal","4 years ago","https://www.youtube.com/watch?v=rHjw7yxcIQQ&lc=UgzSIkGFW7rp5-0CSuF4AaABAg","Someone has a crush on Jenny .","",""
"https://www.youtube.com/@Underagechicken","@Underagechicken","4 years ago","https://www.youtube.com/watch?v=rHjw7yxcIQQ&lc=UgwBZ6oLH4ZGzmOvxPh4AaABAg","Rocky looks like a hard man and I bet he was back in the day","1",""
"https://www.youtube.com/@kaigordon2900","@kaigordon2900","4 years ago","https://www.youtube.com/watch?v=rHjw7yxcIQQ&lc=Ugy1SVRrgcAHlm88nIh4AaABAg","Jenny's face hearing about the free samples was like a drug addict sporting a mountain of coke","1",""
"https://www.youtube.com/@YuToobVideos","@YuToobVideos","4 years ago","https://www.youtube.com/watch?v=rHjw7yxcIQQ&lc=UgxZx_-ngaO65k-AXpd4AaABAg&pp=0gcJCSIANpG00pGi","He used 3 syllables to say ""Create""","",""
"https://www.youtube.com/@KhoufOfficial","@KhoufOfficial","4 years ago","https://www.youtube.com/watch?v=rHjw7yxcIQQ&lc=UgxhW7AuGyNZ2SqnIW14AaABAg","NOOOO HE LEFT THE BIKE BEHIND","",""
"https://www.youtube.com/@philippesoenen4695","@philippesoenen4695","4 years ago","https://www.youtube.com/watch?v=rHjw7yxcIQQ&lc=UgzC_zlrdyCTWlu56cl4AaABAg","is there anyone who can tell me what s the music is in the beginning and the end of this report","",""
"https://www.youtube.com/@i.r9395","@i.r9395","4 years ago (edited)","https://www.youtube.com/watch?v=rHjw7yxcIQQ&lc=UgwZubYJrAKLhJ2Wy0V4AaABAg","Fun fact- the accident they talk about was a road accident, and it also happened to be filmed on one of the 999 type shows.
I noticed it when watching the 999 show...and I went... Wait... That's the PIE GUY FROM DRAGONS DEN.

EDIT: this comment is only apparently in the original ep, but if you want to know more, I've linked to his fb group below talking about it!","3",""
"https://www.youtube.com/@Gamertag5714","@Gamertag5714","4 years ago","https://www.youtube.com/watch?v=rHjw7yxcIQQ&lc=Ugxu1mKNnCKFSWz4U3d4AaABAg","Ahhhh bless him rocky i really wanted him to get an investment. What a great character he is and pies look awesome too !","45",""
"https://www.youtube.com/@jwgaming7697","@jwgaming7697","4 years ago","https://www.youtube.com/watch?v=rHjw7yxcIQQ&lc=Ugybh9jq3HF1jw-f8Bt4AaABAg","Jenny absolutely wolfing it down","1",""
"https://www.youtube.com/@kowalski-turniton6704","@kowalski-turniton6704","4 years ago","https://www.youtube.com/watch?v=rHjw7yxcIQQ&lc=UgzG6z5zJBBbvJd_GY54AaABAg","Wonder what type of pie he wanted to share with Jenny talking at the end.","",""
"https://www.youtube.com/@freezasama5802","@freezasama5802","4 years ago","https://www.youtube.com/watch?v=rHjw7yxcIQQ&lc=UgwJuA8ldbylibnVLfZ4AaABAg","This is on BBC iplayer it's a shame they don't invest he's such a nice old chap talking about socks","6",""
"https://www.youtube.com/@nugsruleify","@nugsruleify","4 years ago","https://www.youtube.com/watch?v=rHjw7yxcIQQ&lc=UgwfjYU_3d25FXF3WPx4AaABAg","59 he looks and sounds 80. That's what smoking does to ya.","15",""
"https://www.youtube.com/@Persian-Immortal","@Persian-Immortal","4 years ago","https://www.youtube.com/watch?v=rHjw7yxcIQQ&lc=UgzSIkGFW7rp5-0CSuF4AaABAg","Someone has a crush on Jenny .","","https://yt3.ggpht.com/yNyH-5WQ3MYTiEdNfPIEyGpcYa3bKONlG7-_ionrpxD_2xM4TmkrbbDXY-20vAr9q9acxIJI=s88-c-k-c0x00ffffff-no-rj"
"https://www.youtube.com/@Underagechicken","@Underagechicken","4 years ago","https://www.youtube.com/watch?v=rHjw7yxcIQQ&lc=UgwBZ6oLH4ZGzmOvxPh4AaABAg","Rocky looks like a hard man and I bet he was back in the day","1","https://yt3.ggpht.com/jgPwdMKXCuU8buQwBZirKH6XC84FlM_bPKbfUY2u0jlFDp-4vJcYW3-hFk9VWfWAClxecZsb3w=s88-c-k-c0x00ffffff-no-rj"
"https://www.youtube.com/@kaigordon2900","@kaigordon2900","4 years ago","https://www.youtube.com/watch?v=rHjw7yxcIQQ&lc=Ugy1SVRrgcAHlm88nIh4AaABAg","Jenny's face hearing about the free samples was like a drug addict sporting a mountain of coke","1","https://yt3.ggpht.com/ytc/AIdro_lu89pkU-W2DYww2VLkkzQO_l1nf5V4p8j3PFpvq8MYadA=s88-c-k-c0x00ffffff-no-rj"
"https://www.youtube.com/@YuToobVideos","@YuToobVideos","4 years ago","https://www.youtube.com/watch?v=rHjw7yxcIQQ&lc=UgxZx_-ngaO65k-AXpd4AaABAg&pp=0gcJCSIANpG00pGi","He used 3 syllables to say ""Create""","","https://yt3.ggpht.com/69h5tX-kKsubDsXdUQp_wXBF03Pt87Wh4hZcBjvjhrhafBG7TW5jHZbTGkahZCloD9U6OfFtMw=s88-c-k-c0x00ffffff-no-rj"
"https://www.youtube.com/@KhoufOfficial","@KhoufOfficial","4 years ago","https://www.youtube.com/watch?v=rHjw7yxcIQQ&lc=UgxhW7AuGyNZ2SqnIW14AaABAg","NOOOO HE LEFT THE BIKE BEHIND","","https://yt3.ggpht.com/ytc/AIdro_nbXnPIAS1yukDlZZvHbhITfQY6Z_72JkLEXXRMpeHsGiI=s88-c-k-c0x00ffffff-no-rj"
"https://www.youtube.com/@philippesoenen4695","@philippesoenen4695","4 years ago","https://www.youtube.com/watch?v=rHjw7yxcIQQ&lc=UgzC_zlrdyCTWlu56cl4AaABAg","is there anyone who can tell me what s the music is in the beginning and the end of this report","","https://yt3.ggpht.com/ytc/AIdro_kH_EoeiIi9HV8TjBEdfsnILkx-rcARHoOjEiATBUA=s88-c-k-c0x00ffffff-no-rj"
"https://www.youtube.com/@i.r9395","@i.r9395","4 years ago (edited)","https://www.youtube.com/watch?v=rHjw7yxcIQQ&lc=UgwZubYJrAKLhJ2Wy0V4AaABAg","Fun fact- the accident they talk about was a road accident, and it also happened to be filmed on one of the 999 type shows.
I noticed it when watching the 999 show...and I went... Wait... That's the PIE GUY FROM DRAGONS DEN.

EDIT: this comment is only apparently in the original ep, but if you want to know more, I've linked to his fb group below talking about it!","3","https://yt3.ggpht.com/ytc/AIdro_l5CrsC1kn-RyGQsQgeEZrH6AXv-N_Q1WCSOuaTAHy6bXqruU3cI4TdyFKMSlgV-7ED_w=s88-c-k-c0x00ffffff-no-rj"
"https://www.youtube.com/@jwgaming7697","@jwgaming7697","4 years ago","https://www.youtube.com/watch?v=rHjw7yxcIQQ&lc=Ugybh9jq3HF1jw-f8Bt4AaABAg","Jenny absolutely wolfing it down","1","https://yt3.ggpht.com/ytc/AIdro_nszkWIytDjVtezKyP9783KmKF5pcRCglpFmfFnpDn6Pgo=s88-c-k-c0x00ffffff-no-rj"
"https://www.youtube.com/@kowalski-turniton6704","@kowalski-turniton6704","4 years ago","https://www.youtube.com/watch?v=rHjw7yxcIQQ&lc=UgzG6z5zJBBbvJd_GY54AaABAg","Wonder what type of pie he wanted to share with Jenny talking at the end.","","https://yt3.ggpht.com/ytc/AIdro_mBIJhT_r9oKRJx5phcZ8SUV_cnNAluby-Yqtx1Us6Qvg=s88-c-k-c0x00ffffff-no-rj"
"https://www.youtube.com/@freezasama5802","@freezasama5802","4 years ago","https://www.youtube.com/watch?v=rHjw7yxcIQQ&lc=UgwJuA8ldbylibnVLfZ4AaABAg","This is on BBC iplayer it's a shame they don't invest he's such a nice old chap talking about socks","6","https://yt3.ggpht.com/ytc/AIdro_lAFasXAke7l_I63VL3HN_XJ8LD7vX0tx1N6ICG9mKiHQ=s88-c-k-c0x00ffffff-no-rj"
"https://www.youtube.com/@nugsruleify","@nugsruleify","4 years ago","https://www.youtube.com/watch?v=rHjw7yxcIQQ&lc=UgwfjYU_3d25FXF3WPx4AaABAg","59 he looks and sounds 80. That's what smoking does to ya.","15","https://yt3.ggpht.com/ytc/AIdro_mtLYo8DjtjcANsyW8GLafhjrtSCyHMkSKxuz2dBw4=s88-c-k-c0x00ffffff-no-rj"
"https://www.youtube.com/@TheJohnCooperShow","@TheJohnCooperShow","4 years ago","https://www.youtube.com/watch?v=rHjw7yxcIQQ&lc=Ugz1yGjIFoLE7fsn_kF4AaABAg","Why do all northerners looks 20 years older than their age?","","https://yt3.ggpht.com/cH1rwEv-qlrqZe-_zM30Yb3a-IkfXEH1ZQoNZVINYM50OAANgOmwaEvpCrCjvWJ_mLMq2GkGyw=s88-c-k-c0x00ffffff-no-rj"
"https://www.youtube.com/@baroncorvo3813","@baroncorvo3813","4 years ago","https://www.youtube.com/watch?v=rHjw7yxcIQQ&lc=UgxrDy7KCOVstMSllpd4AaABAg","Fook arf, I'm oot.","","https://yt3.ggpht.com/oPVzzjpXHfsvAVizYDOU51PAw9O4IsaSFZ5gChSai46uZt5GRGgNahJaSVXVbprCDYEYJ4NxjA=s88-c-k-c0x00ffffff-no-rj"
"https://www.youtube.com/@2russo.phobic4u","@2russo.phobic4u","4 years ago","https://www.youtube.com/watch?v=rHjw7yxcIQQ&lc=UgzcgCxvUI6fheb7xUB4AaABAg","Does he put his mouth foam in his pies?","1","https://yt3.ggpht.com/ytc/AIdro_k3bcXClnX-zXOcnJEVWUWuRsxzxSL_Zzr15l560D4AAGs=s88-c-k-c0x00ffffff-no-rj"
"https://www.youtube.com/@AshPPPPPPPP","@AshPPPPPPPP","4 years ago","https://www.youtube.com/watch?v=rHjw7yxcIQQ&lc=UgyFYwNp566gZGqIHfd4AaABAg","I would have invested. Gold mine he got here","1","https://yt3.ggpht.com/ytc/AIdro_lN1r14JyVE1HV827fOA4jwcUpML9JATe2vub3wBZwgdO1_u1mEpcWHSejRd9oj5lcaaA=s88-c-k-c0x00ffffff-no-rj"
"https://www.youtube.com/@steve2244","@steve2244","4 years ago","https://www.youtube.com/watch?v=rHjw7yxcIQQ&lc=UgyB8papWBnFKhuIdgl4AaABAg","Hes not even that old. Playing up to it I think.","10","https://yt3.ggpht.com/ytc/AIdro_nBPDCG_qhzgG53HHH5VsOomEzTt4fdlsjELOjEHMfANEtf=s88-c-k-c0x00ffffff-no-rj"
"https://www.youtube.com/@Anna.T.","@Anna.T.","4 years ago (edited)","https://www.youtube.com/watch?v=rHjw7yxcIQQ&lc=Ugyq90ybjzuGKnCwX7F4AaABAg","Jenny, From The North: I’m a Northern gal. For that reason, Northenern to Northenern, I’m out.","5","https://yt3.ggpht.com/BAyXdqroakzDVhZveUcuuRLdp8oetHFuQKz-mUoeXMS_unthZr31YCD0EoqGkTKu5coMuMaS=s88-c-k-c0x00ffffff-no-rj"
"https://www.youtube.com/@johnsweda2999","@johnsweda2999","4 years ago (edited)","https://www.youtube.com/watch?v=rHjw7yxcIQQ&lc=UgzEDqeh8CG1Ok9pvOZ4AaABAg","You can scale it up without changing the taste! if they're done in small individual batches instead of one big batch would take you the same time in manufacturing but of course cost is a bit more 
I'd love to try his pies anywhere you can buy them","1","https://yt3.ggpht.com/ytc/AIdro_mtg4acl_UcW7J5Lc-A1kowxFWesEE_rPlRoRc8S9PJaA=s88-c-k-c0x00ffffff-no-rj"
"https://www.youtube.com/@ainsleyharriott2209","@ainsleyharriott2209","4 years ago","https://www.youtube.com/watch?v=rHjw7yxcIQQ&lc=UgxAUO-2avMuAcCq9Ut4AaABAg","If he went with Jenny’s suggestion at the end he could start a silicon valley startup creating artificially intelligent virtual pies that the consumers enjoy digitally from their smartphones","",""
"https://www.youtube.com/@MoAli72","@MoAli72","4 years ago","https://www.youtube.com/watch?v=rHjw7yxcIQQ&lc=UgwOcmyRu_artwpmfkl4AaABAg","Sounds like Lord of the Rings at the beginning.","3",""
"https://www.youtube.com/@robertballuumm730","@robertballuumm730","4 years ago","https://www.youtube.com/watch?v=rHjw7yxcIQQ&lc=UgzLHOoA_MlCMdW9cx94AaABAg&pp=0gcJCSIANpG00pGi","I really hope that he can grow his business. He clearly has a lot of passion and a wonderful personality. I wish him well in both health and success.","19",""
"https://www.youtube.com/@stormchild831","@stormchild831","4 years ago (edited)","https://www.youtube.com/watch?v=rHjw7yxcIQQ&lc=Ugy_XHuL0dPYnXDIQVp4AaABAg","Simple Simon met a pieman,
    Going to the fair;
    Says Simple Simon to the pieman,
    Let me taste your ware.

    Says the pieman to Simple Simon,
    Show me first your penny;
    Says Simple Simon to the pieman,
    I'm not Simon,Mate, Ha, caught you, Out ! Im Jenny ...  : )","2",""
"https://www.youtube.com/@stephenfox8685","@stephenfox8685","4 years ago","https://www.youtube.com/watch?v=rHjw7yxcIQQ&lc=UgwhOaqwGv0Yq69VLsR4AaABAg","Nice guy. Admirable goals, considering his age and past health. My salute.","23",""
"https://www.youtube.com/@colinluby5950","@colinluby5950","4 years ago","https://www.youtube.com/watch?v=rHjw7yxcIQQ&lc=UgzFwxPHQczxt4iQvHV4AaABAg&pp=0gcJCSIANpG00pGi","Secret ingredient = elbow grease","1",""
"https://www.youtube.com/@oracle1081","@oracle1081","4 years ago","https://www.youtube.com/watch?v=rHjw7yxcIQQ&lc=UgwT2d_-ofRDqh6HKEt4AaABAg","I can't find the financials, but his social media is still running and tagging clips like this, so he must be doing fine.","10",""
"https://www.youtube.com/@robinabernathy2829","@robinabernathy2829","4 years ago","https://www.youtube.com/watch?v=rHjw7yxcIQQ&lc=Ugy8UjX26Kr45yKg3094AaABAg","I want one of those hangover pies.","3",""
"https://www.youtube.com/@marypoppins8083","@marypoppins8083","4 years ago (edited)","https://www.youtube.com/watch?v=rHjw7yxcIQQ&lc=Ugw__MCaXcb9UZMarxJ4AaABAg","creme egg and custard pie yum i would buy  and try all these  pie's in a supermarket","",""
"https://www.youtube.com/@Harsha-dy9yr","@Harsha-dy9yr","4 years ago","https://www.youtube.com/watch?v=rHjw7yxcIQQ&lc=UgwJWU8_SpB77L0LYat4AaABAg","What so brilliant having a colorful scoks.....","",""
"https://www.youtube.com/@DJCBAR","@DJCBAR","4 years ago","https://www.youtube.com/watch?v=rHjw7yxcIQQ&lc=Ugz7vkxxQIrToKhuQCV4AaABAg","“I’m out”","10",""
"https://www.youtube.com/@seanjosephhayes","@seanjosephhayes","4 years ago","https://www.youtube.com/watch?v=rHjw7yxcIQQ&lc=UgwV8J1JjpeMFI81xQp4AaABAg&pp=0gcJCSIANpG00pGi","In the pie of the beholder... Jesus Christ just give up Evan... Just give up...","7",""
"https://www.youtube.com/@capcompass9298","@capcompass9298","4 years ago","https://www.youtube.com/watch?v=rHjw7yxcIQQ&lc=UgwnLlrWnK96z_ZIdgB4AaABAg&pp=0gcJCSIANpG00pGi","With so many things, if you become a character who sells a product, people identify with the character will try\buy the product.
It's almost like being an actor who sells a product.","",""
"https://www.youtube.com/@MoAli72","@MoAli72","4 years ago","https://www.youtube.com/watch?v=rHjw7yxcIQQ&lc=UgwOcmyRu_artwpmfkl4AaABAg","Sounds like Lord of the Rings at the beginning.","3","https://yt3.ggpht.com/gmOTPA2e4_LWCeRwDo9s44QW1x0J21gF1T0FRRNozfYVD_nt1tjCWrmJt17UVP0aiGYRNbCEYQ=s88-c-k-c0x00ffffff-no-rj"
"https://www.youtube.com/@robertballuumm730","@robertballuumm730","4 years ago","https://www.youtube.com/watch?v=rHjw7yxcIQQ&lc=UgzLHOoA_MlCMdW9cx94AaABAg&pp=0gcJCSIANpG00pGi","I really hope that he can grow his business. He clearly has a lot of passion and a wonderful personality. I wish him well in both health and success.","19","https://yt3.ggpht.com/ytc/AIdro_nOwVCsm8WLXmNr5KoqHuM6JZJ6TFzvif0PxL1Z_hE=s88-c-k-c0x00ffffff-no-rj"
"https://www.youtube.com/@stormchild831","@stormchild831","4 years ago (edited)","https://www.youtube.com/watch?v=rHjw7yxcIQQ&lc=Ugy_XHuL0dPYnXDIQVp4AaABAg","Simple Simon met a pieman,
    Going to the fair;
    Says Simple Simon to the pieman,
    Let me taste your ware.

    Says the pieman to Simple Simon,
    Show me first your penny;
    Says Simple Simon to the pieman,
    I'm not Simon,Mate, Ha, caught you, Out ! Im Jenny ...  : )","2","https://yt3.ggpht.com/ytc/AIdro_n4moRLC9qDHxUTAWRlAofb5rkoQz0oCvuBHvN66LefDm0=s88-c-k-c0x00ffffff-no-rj"
"https://www.youtube.com/@stephenfox8685","@stephenfox8685","4 years ago","https://www.youtube.com/watch?v=rHjw7yxcIQQ&lc=UgwhOaqwGv0Yq69VLsR4AaABAg","Nice guy. Admirable goals, considering his age and past health. My salute.","23","https://yt3.ggpht.com/ytc/AIdro_kVSvKjNDQbyeOvRgGmHWncdMvZ5yyLhvcdt4BXyWo=s88-c-k-c0x00ffffff-no-rj"
"https://www.youtube.com/@colinluby5950","@colinluby5950","4 years ago","https://www.youtube.com/watch?v=rHjw7yxcIQQ&lc=UgzFwxPHQczxt4iQvHV4AaABAg&pp=0gcJCSIANpG00pGi","Secret ingredient = elbow grease","1","https://yt3.ggpht.com/ytc/AIdro_m8YBjMeS4X7r_sFzbQoV0Z6H20tniI_5hZNYbIs14=s88-c-k-c0x00ffffff-no-rj"
"https://www.youtube.com/@oracle1081","@oracle1081","4 years ago","https://www.youtube.com/watch?v=rHjw7yxcIQQ&lc=UgwT2d_-ofRDqh6HKEt4AaABAg","I can't find the financials, but his social media is still running and tagging clips like this, so he must be doing fine.","10","https://yt3.ggpht.com/ysFb-EzMCPcB9DmRlH7V25SaOwoFPBS8_8tHqPLyyoZ6w8ndWC2jWST02dW1ypVyDTBOq9VnjQ=s88-c-k-c0x00ffffff-no-rj"
"https://www.youtube.com/@robinabernathy2829","@robinabernathy2829","4 years ago","https://www.youtube.com/watch?v=rHjw7yxcIQQ&lc=Ugy8UjX26Kr45yKg3094AaABAg","I want one of those hangover pies.","3","https://yt3.ggpht.com/ytc/AIdro_lJHC22pmAyzjxKqHLysq8lL6jStC6wA_ipYj4syUM=s88-c-k-c0x00ffffff-no-rj"
"https://www.youtube.com/@marypoppins8083","@marypoppins8083","4 years ago (edited)","https://www.youtube.com/watch?v=rHjw7yxcIQQ&lc=Ugw__MCaXcb9UZMarxJ4AaABAg","creme egg and custard pie yum i would buy  and try all these  pie's in a supermarket","","https://yt3.ggpht.com/ytc/AIdro_lvslvQsOPWhtSz9rg9lsxktg8RW6l0_Xb4egXmvQU=s88-c-k-c0x00ffffff-no-rj"
"https://www.youtube.com/@DJCBAR","@DJCBAR","4 years ago","https://www.youtube.com/watch?v=rHjw7yxcIQQ&lc=Ugz7vkxxQIrToKhuQCV4AaABAg","“I’m out”","10","https://yt3.ggpht.com/Vp4lce9U_mMm_8DxYG5FnFVNJ0LYAvW6koxc1PX83Qof_VoeK5_Cd-XQbyQUyrt7mo2ZjpfaYWc=s88-c-k-c0x00ffffff-no-rj"
"https://www.youtube.com/@seanjosephhayes","@seanjosephhayes","4 years ago","https://www.youtube.com/watch?v=rHjw7yxcIQQ&lc=UgwV8J1JjpeMFI81xQp4AaABAg&pp=0gcJCSIANpG00pGi","In the pie of the beholder... Jesus Christ just give up Evan... Just give up...","7","https://yt3.ggpht.com/ytc/AIdro_kyxrI8EpQDg91Nz1DuS0VL1WQcRwVh3MTqNwqCRQhYqZo=s88-c-k-c0x00ffffff-no-rj"
