"style-scope src","yt-simple-endpoint href","style-scope","Account name","yt-simple-endpoint href 2","yt-core-attributed-string","style-scope 2","yt-core-attributed-string 3"
"https://yt3.ggpht.com/ytc/AIdro_kY0SQ4nVNk51HTL-grtdIk2MK18rJSi2GS2niZu0s=s88-c-k-c0x00ffffff-no-rj","https://www.youtube.com/@indigokiller","@indigokiller","5 years ago","https://www.youtube.com/watch?v=cgH69u-mPUI&lc=UgztCYC9QJYnVT5zLxV4AaABAg","i invest 50% of my time watching dragon's den videos and the other 50% reading the comments. the returns are staggering.","1.7K","26 replies"
"https://yt3.ggpht.com/3-NHJeED9u1jB6FM6sdbQ7xZAtLLOGTe68Mk0FSmEGR3rS4_DJL2wCYjiHiS7DXtCAk7e22dsQ=s88-c-k-c0x00ffffff-no-rj","https://www.youtube.com/@kingGALLOOM","@kingGALLOOM","6 years ago","https://www.youtube.com/watch?v=cgH69u-mPUI&lc=UgyHyfs4_BHStOWBSYd4AaABAg&pp=0gcJCSIANpG00pGi","Touker: I don’t get out of bed for 4%","1.8K","19 replies"
"https://yt3.ggpht.com/ytc/AIdro_lN1r14JyVE1HV827fOA4jwcUpML9JATe2vub3wBZwgdO1_u1mEpcWHSejRd9oj5lcaaA=s88-c-k-c0x00ffffff-no-rj","https://www.youtube.com/@AndrewJJ-0114","@AndrewJJ-0114","6 years ago","https://www.youtube.com/watch?v=cgH69u-mPUI&lc=Ugy77l0LDOYMLkHEmjh4AaABAg&pp=0gcJCSIANpG00pGi","Given Peter's behaviour while they were giving their pitch, they should have given him a book about the little boy who visited the Train, then he visited the Wizard, then he spoke to the Ant, then the Tiger.","2.4K","49 replies"
"https://yt3.ggpht.com/ytc/AIdro_moX88WYtYpICdykzymcmNkMRM0XEl46y4Fmdz2VQlVtkQ=s88-c-k-c0x00ffffff-no-rj","https://www.youtube.com/@ProjectSamari","@ProjectSamari","6 years ago","https://www.youtube.com/watch?v=cgH69u-mPUI&lc=Ugyjyy_It6NiKbp6l7t4AaABAg","man whoever puts these videos up really does Deborah dirty with the thumbnails haha","2.5K","22 replies"
"https://yt3.ggpht.com/ytc/AIdro_l5riyi3qSVbT4soL8PbzTHwwy6Ep2Vl4V82C4Z1RIvHw=s88-c-k-c0x00ffffff-no-rj","https://www.youtube.com/@sappypngn","@sappypngn","5 years ago","https://www.youtube.com/watch?v=cgH69u-mPUI&lc=UgySqUQOHDrBLkg018V4AaABAg&pp=0gcJCSIANpG00pGi","I tried to order a book for my niece named Jenny. The website gave an error code and then said they're out.","405","8 replies"
"https://yt3.ggpht.com/ytc/AIdro_mGtSmgq2og4Zg_gmdeX3FtfDjLD0fulHZcngzFxXI=s88-c-k-c0x00ffffff-no-rj","https://www.youtube.com/@jackolas2007","@jackolas2007","5 years ago","https://www.youtube.com/watch?v=cgH69u-mPUI&lc=UgyWwnUzt8oRArrRza94AaABAg","Jenny's book would have included: Inuit, Marmalade, Octopus, Umbrella, Tiger ...","605","11 replies"
"https://yt3.ggpht.com/ytc/AIdro_kGQ1J3eLGc3gJQIcRNISnkCy3mnEOBPfRH7DDLQn6f-w=s88-c-k-c0x00ffffff-no-rj","https://www.youtube.com/@DarkReapersGrim","@DarkReapersGrim","5 years ago","https://www.youtube.com/watch?v=cgH69u-mPUI&lc=UgwL73aYxoiMHb5NNMR4AaABAg","I'm a grown man with no kids and I want one of these books with my name in it.","289","3 replies"
"https://yt3.ggpht.com/ytc/AIdro_kWaKCnsomR2Fbq8kOHL8iUz5-qBSuAgois0zdSusY=s88-c-k-c0x00ffffff-no-rj","https://www.youtube.com/@Snow1e","@Snow1e","6 years ago","https://www.youtube.com/watch?v=cgH69u-mPUI&lc=UgwMok4IbNvjXdxMQh54AaABAg","Peter doesn't like anyone taller than him.","677","32 replies"
"https://yt3.ggpht.com/ytc/AIdro_kx2h13XVTqayv249ZTrKVzz2jPrn5pdJ-snko6N30Oz-w=s88-c-k-c0x00ffffff-no-rj","https://www.youtube.com/@K.awan_1","@K.awan_1","6 years ago (edited)","https://www.youtube.com/watch?v=cgH69u-mPUI&lc=UgwXsxIAldG1MNc5yt54AaABAg","They renamed their business to ""Wonderbly"" and the picturebook became the best-seller photo book of UK in 2018. Until now they have expanded to more than 10 countries and have already sold more than 4 million books.","273","7 replies"
"","https://www.youtube.com/@Fireglo","@Fireglo","5 years ago","https://www.youtube.com/watch?v=cgH69u-mPUI&lc=UgxGCbvbdNRTDwM99T54AaABAg","Peter:  xD","169","sees a guy potentially taller than him, immediately sits up to look more imposing"
"","https://www.youtube.com/@RDR1456","@RDR1456","6 years ago","https://www.youtube.com/watch?v=cgH69u-mPUI&lc=UgzAiL3JaGYYEWpJPnp4AaABAg","I’m guessing Touker is still in bed?

... and Tej thinks he can definitely help them with distribution, but is still out?","483","8 replies"
"","https://www.youtube.com/@theangrybrownman1411","@theangrybrownman1411","6 years ago","https://www.youtube.com/watch?v=cgH69u-mPUI&lc=Ugz5lje5XucVq1DyaKF4AaABAg","""Hang on a minute...isn't it just letters and drawings on some papers? I mean isn't that what this is?! It's not a business and I'm ooot!"" -  Duncan","213","1 reply"
"","https://www.youtube.com/@vegn_brit5176","@vegn_brit5176","5 years ago","https://www.youtube.com/watch?v=cgH69u-mPUI&lc=Ugzxbh6Hs1bNohFmMdp4AaABAg","Piers got the deal. He's on the accounts information at companies house. Well done to him, I can see him banking a good profit with this venture!","100",""
"","https://www.youtube.com/@freedrider1530","@freedrider1530","6 years ago","https://www.youtube.com/watch?v=cgH69u-mPUI&lc=UgyVCXtrs_Znpoa4dJx4AaABAg","My son Uvuvwevwevwe Onyetenyevwe Ugwemuhwem Osas is going to love the 4 volume series of this book.","490","9 replies"
"","https://www.youtube.com/@teiubescducu","@teiubescducu","5 years ago","https://www.youtube.com/watch?v=cgH69u-mPUI&lc=Ugz5Sf8bjskATniXhRl4AaABAg","Jenny is so out that she is not even in this season.","359","5 replies"
"","https://www.youtube.com/@abdiqaniismail695","@abdiqaniismail695","6 years ago","https://www.youtube.com/watch?v=cgH69u-mPUI&lc=UgxYw2Wy3-ZlTiesdTV4AaABAg","Tej: i dont know if you know this but we're the largest children's vitamins company. So we do alot of marketing there i think i can add value.","361","13 replies"
"","https://www.youtube.com/@haydenjones8801","@haydenjones8801","6 years ago","https://www.youtube.com/watch?v=cgH69u-mPUI&lc=UgxB2N9kc7QwN893jvp4AaABAg","When you're watching this just remember... Jennie has two big strapping lads at home","338","6 replies"
"","https://www.youtube.com/@michaelmwe","@michaelmwe","5 years ago","https://www.youtube.com/watch?v=cgH69u-mPUI&lc=UgwzRpuOzuhUCLhkpjd4AaABAg","Why does Piers Linney always look like he’s about to go off in a murderous fit of rage?!","131","8 replies"
"","https://www.youtube.com/@yungnoodlearm","@yungnoodlearm","6 years ago","https://www.youtube.com/watch?v=cgH69u-mPUI&lc=Ugz4TUNgbRKQcbqq_nx4AaABAg","I canne read, and foor that risin arm oot","767","12 replies"
"","https://www.youtube.com/@Gregoryisaac2669","@Gregoryisaac2669","6 years ago","https://www.youtube.com/watch?v=cgH69u-mPUI&lc=UgwfGvfRVFG17Pdl6jZ4AaABAg","I've got 3 kids. Each with 3 letter names. That's 60 buck for about 15 pages in total. Bedtime stories will be quick as fuckery. I'm in","426","59 replies"
"https://yt3.ggpht.com/ytc/AIdro_mB08O8E1PDnuE9l5JSJJXig7XqvKSf4P-1spcT72fO_C4=s88-c-k-c0x00ffffff-no-rj","https://www.youtube.com/@Fireglo","@Fireglo","5 years ago","https://www.youtube.com/watch?v=cgH69u-mPUI&lc=UgxGCbvbdNRTDwM99T54AaABAg","Peter:  xD","169","sees a guy potentially taller than him, immediately sits up to look more imposing"
"https://yt3.ggpht.com/ytc/AIdro_lkvZL6_kz1dOZZNlAfaTAAvzD815r_d0GFkV8C9bR31YRZeGPylgyyE4sM5v8Yxu6Veg=s88-c-k-c0x00ffffff-no-rj","https://www.youtube.com/@RDR1456","@RDR1456","6 years ago","https://www.youtube.com/watch?v=cgH69u-mPUI&lc=UgzAiL3JaGYYEWpJPnp4AaABAg","I’m guessing Touker is still in bed?

... and Tej thinks he can definitely help them with distribution, but is still out?","483","8 replies"
"https://yt3.ggpht.com/gyF-9WS72gnCwTauY96MEdikPrummvz3sCYDZw1WQoKLecnTw99a7lNYCf6q7h8izq5k9-AVD6I=s88-c-k-c0x00ffffff-no-rj","https://www.youtube.com/@theangrybrownman1411","@theangrybrownman1411","6 years ago","https://www.youtube.com/watch?v=cgH69u-mPUI&lc=Ugz5lje5XucVq1DyaKF4AaABAg","""Hang on a minute...isn't it just letters and drawings on some papers? I mean isn't that what this is?! It's not a business and I'm ooot!"" -  Duncan","213","1 reply"
"https://yt3.ggpht.com/ytc/AIdro_k6JHNQwqsAbdDje5JCcgbqiqkUglvXMhy4Aol1BBog2A=s88-c-k-c0x00ffffff-no-rj","https://www.youtube.com/@vegn_brit5176","@vegn_brit5176","5 years ago","https://www.youtube.com/watch?v=cgH69u-mPUI&lc=Ugzxbh6Hs1bNohFmMdp4AaABAg","Piers got the deal. He's on the accounts information at companies house. Well done to him, I can see him banking a good profit with this venture!","100",""
"https://yt3.ggpht.com/ytc/AIdro_k0DiqLs9u5pDtvJcehPhN2ReMsB__Up3u_JFtg9ys=s88-c-k-c0x00ffffff-no-rj","https://www.youtube.com/@freedrider1530","@freedrider1530","6 years ago","https://www.youtube.com/watch?v=cgH69u-mPUI&lc=UgyVCXtrs_Znpoa4dJx4AaABAg","My son Uvuvwevwevwe Onyetenyevwe Ugwemuhwem Osas is going to love the 4 volume series of this book.","490","9 replies"
"https://yt3.ggpht.com/ytc/AIdro_neknAtT6X2fILk6BaxApWQtqPNSi_sIOf9C0xwkHg=s88-c-k-c0x00ffffff-no-rj","https://www.youtube.com/@teiubescducu","@teiubescducu","5 years ago","https://www.youtube.com/watch?v=cgH69u-mPUI&lc=Ugz5Sf8bjskATniXhRl4AaABAg","Jenny is so out that she is not even in this season.","359","5 replies"
"https://yt3.ggpht.com/ytc/AIdro_mDGDdd2-8gxkdKul6yAKnzxqPO7u92Bf1uf-S-oTc=s88-c-k-c0x00ffffff-no-rj","https://www.youtube.com/@abdiqaniismail695","@abdiqaniismail695","6 years ago","https://www.youtube.com/watch?v=cgH69u-mPUI&lc=UgxYw2Wy3-ZlTiesdTV4AaABAg","Tej: i dont know if you know this but we're the largest children's vitamins company. So we do alot of marketing there i think i can add value.","361","13 replies"
"https://yt3.ggpht.com/ytc/AIdro_mi6oiX1QfZF_pc2QNZJyIKcrbo2D1Bl1RfLvfQpLI=s88-c-k-c0x00ffffff-no-rj","https://www.youtube.com/@haydenjones8801","@haydenjones8801","6 years ago","https://www.youtube.com/watch?v=cgH69u-mPUI&lc=UgxB2N9kc7QwN893jvp4AaABAg","When you're watching this just remember... Jennie has two big strapping lads at home","338","6 replies"
"https://yt3.ggpht.com/ytc/AIdro_mdfg0HjVnKcSir3QgzWCBVJvq4el3iYEcIAgl9nDk0uUI=s88-c-k-c0x00ffffff-no-rj","https://www.youtube.com/@michaelmwe","@michaelmwe","5 years ago","https://www.youtube.com/watch?v=cgH69u-mPUI&lc=UgwzRpuOzuhUCLhkpjd4AaABAg","Why does Piers Linney always look like he’s about to go off in a murderous fit of rage?!","131","8 replies"
"https://yt3.ggpht.com/ZXKqxgBkdrN9l41baAlNQyN1_Rmdh_UPfONgooRStVGNxFsyHukEINaHSwQWomBLr7G0lERs=s88-c-k-c0x00ffffff-no-rj","https://www.youtube.com/@yungnoodlearm","@yungnoodlearm","6 years ago","https://www.youtube.com/watch?v=cgH69u-mPUI&lc=Ugz4TUNgbRKQcbqq_nx4AaABAg","I canne read, and foor that risin arm oot","767","12 replies"
"https://yt3.ggpht.com/ytc/AIdro_nxD7eTXBA5iUaLZmCQrPDXyKw9eMZ7JKRriegncRoCnn_XRrAEQ7ckpgil4YDZdF1_DQ=s88-c-k-c0x00ffffff-no-rj","https://www.youtube.com/@Gregoryisaac2669","@Gregoryisaac2669","6 years ago","https://www.youtube.com/watch?v=cgH69u-mPUI&lc=UgwfGvfRVFG17Pdl6jZ4AaABAg","I've got 3 kids. Each with 3 letter names. That's 60 buck for about 15 pages in total. Bedtime stories will be quick as fuckery. I'm in","426","59 replies"
"https://yt3.ggpht.com/ytc/AIdro_lF1R7sYnEkSihiONCu6BVrR0bmBQ1Nfp85HAh6P6UYX98=s88-c-k-c0x00ffffff-no-rj","https://www.youtube.com/@FILIPOSCAR","@FILIPOSCAR","5 years ago","https://www.youtube.com/watch?v=cgH69u-mPUI&lc=UgxlY_qqC-OhCuqyVwt4AaABAg","Piers is an extremely clever lad, waiting for all the dragons to declare themselves out before trying to get a piece of the pie. Leave no stone unturned, or as Deborah would say ""Yeah, but this isn't fair!"" lol. Well played Sir Linney.","50",""
"https://yt3.ggpht.com/7Ou6QxWfQp1TfOJ-Nh5OlJTPpfarPLfAPPrqGFWHHmgO2bNZb2_J6zUeoL73xR-hBpc8Hc4z7w=s88-c-k-c0x00ffffff-no-rj","https://www.youtube.com/@CrazzedKor","@CrazzedKor","6 years ago (edited)","https://www.youtube.com/watch?v=cgH69u-mPUI&lc=UgwSeGOgDDWA7RMPfFR4AaABAg","This company is very very successful today, and Piers Linney is named with them so it got accepted or further negotiated a deal","149","4 replies"
"https://yt3.ggpht.com/-vKXhr6gxgA0HT3xTePXGnSb9D7HqHmpngXo0mShR-q-SzUxSo1L13rFZv9K5tUHRdI-QIRD=s88-c-k-c0x00ffffff-no-rj","https://www.youtube.com/@UserRandomSenders123","@UserRandomSenders123","6 years ago","https://www.youtube.com/watch?v=cgH69u-mPUI&lc=UgyEezW2e-srtn0Ge2V4AaABAg","Peters reaction to him explaining the letters is priceless","137","5 replies"
"https://yt3.ggpht.com/yQLPw9v8dLG3dAgdl383flnFzemoTGiLM5euoWSOF5or0V63_AtN4-Q1WZT2LLNShX-QjO71Dn0=s88-c-k-c0x00ffffff-no-rj","https://www.youtube.com/@JustMitchPool","@JustMitchPool","6 years ago","https://www.youtube.com/watch?v=cgH69u-mPUI&lc=UgzNd4HwqyQvZsuxslt4AaABAg","“Hi I’m Jenny, my name isn’t in the book for your pitch...for that reason...I’m out”","97",""
"https://yt3.ggpht.com/ytc/AIdro_mE3wjoryzB1xooisi120XigTV2GZ50MpsNJhBvYeM=s88-c-k-c0x00ffffff-no-rj","https://www.youtube.com/@johnandrews6312","@johnandrews6312","5 years ago","https://www.youtube.com/watch?v=cgH69u-mPUI&lc=Ugxexfe9iuxLuHHoIoZ4AaABAg","Let’s hear from the Dragons......
Peter: I will offer £5 for 90% of the business 
Deborah: meh 
Tej: thinks he can add real value, gets rejected
Jenny: always out 
Touker: need an office?","83","2 replies"
"https://yt3.ggpht.com/ytc/AIdro_lp5rj-SnlRcnmXvbae-lW1mbc2KHW0EVN7cbapFgvm1A=s88-c-k-c0x00ffffff-no-rj","https://www.youtube.com/@juffjaff","@juffjaff","6 years ago","https://www.youtube.com/watch?v=cgH69u-mPUI&lc=UgzZV_Gw6L0N-0aTkcd4AaABAg","Their enthusiasm for their own product is off the charts.","134","12 replies"
"","https://www.youtube.com/@maybenah","@maybenah","5 years ago","https://www.youtube.com/watch?v=cgH69u-mPUI&lc=UgxJDpgE146J2quljZ14AaABAg","I wonder if jenny has ever read these comments and then just logged out","47","2 replies"
"","https://www.youtube.com/@yongslicer","@yongslicer","6 years ago","https://www.youtube.com/watch?v=cgH69u-mPUI&lc=Ugw3cyZZJs0aJmDwwi14AaABAg","Quite disappointing that the other dragons didn't try to negotiate the non-negotiable offer. Really pleased with Piers on this one, there's no harm to see if it's possible and he got a better deal.","48","3 replies"
"","https://www.youtube.com/@-_Alyssia_-","@-_Alyssia_-","6 years ago","https://www.youtube.com/watch?v=cgH69u-mPUI&lc=UgxpvVpkpUxExB9xa1p4AaABAg","So I went to their site and the longest possible name I could rip them off with was 11 characters.","43","2 replies"
"","https://www.youtube.com/@JL-gf3yc","@JL-gf3yc","1 month ago","https://www.youtube.com/watch?v=cgH69u-mPUI&lc=UgzgwZp6DOhjlQjNlEh4AaABAg","The good old days when valuations were taken seriously by the investors","1",""
"","https://www.youtube.com/@allewis86","@allewis86","6 years ago (edited)","https://www.youtube.com/watch?v=cgH69u-mPUI&lc=UgwN5b1l4-H5Ud40QQB4AaABAg","I love watching old Dragon's Den episodes where the Dragon's are underwhelmed or pass on a product which turns out to be quite successful in today's market. I personally have bought these books for my two children and think they're absolutely brilliant and worth every penny. To answer your question Peter, yes, in 5 years time 100k for 4% COULD have gotten you a return.","320","23 replies"
"","https://www.youtube.com/@tiztisdale1784","@tiztisdale1784","6 years ago","https://www.youtube.com/watch?v=cgH69u-mPUI&lc=UgzYD_sC_axEN-ESYNN4AaABAg","""Hi Dragons, my name is ---""    Jenny: ""Hi. My name is Jenny. And for that reason, I'm out.""","35",""
"","https://www.youtube.com/@TomorrowWeLive","@TomorrowWeLive","6 years ago","https://www.youtube.com/watch?v=cgH69u-mPUI&lc=Ugx1sv9Yn-IAVA47su14AaABAg","I like that Deborah spoke up on their behalf. She's always been my favourite.","285","7 replies"
"","https://www.youtube.com/@mma4179","@mma4179","5 years ago","https://www.youtube.com/watch?v=cgH69u-mPUI&lc=UgwZQrP42bUfwfx90qh4AaABAg","One of the books had Jenny’s name, but the book was out of stock.","14",""
"","https://www.youtube.com/@bobosmodernlife","@bobosmodernlife","5 years ago","https://www.youtube.com/watch?v=cgH69u-mPUI&lc=Ugz2NQctSTBaLIcvZ7l4AaABAg","Did the other investors accept the terms is the big question.","18",""
"","https://www.youtube.com/@riri6345","@riri6345","5 years ago (edited)","https://www.youtube.com/watch?v=cgH69u-mPUI&lc=Ugx98ncV0B9Uw3NverV4AaABAg","Jenny is obviously not there because she’s still out....","67",""
"","https://www.youtube.com/@bax442","@bax442","6 years ago","https://www.youtube.com/watch?v=cgH69u-mPUI&lc=UgwIenOZn-bD818eOl14AaABAg","Doubrah was wrong, pierse actually got 4% in the end. Company was a best selling book in 2018. Company is currently making over 9mln us dollars.","215","9 replies"
"","https://www.youtube.com/@MoonlapseVertigo23","@MoonlapseVertigo23","5 years ago","https://www.youtube.com/watch?v=cgH69u-mPUI&lc=Ugz3PCqjphFJp_rFgMh4AaABAg","When you've bought the book even before seeing this video","8",""
"","https://www.youtube.com/@ashleelmb","@ashleelmb","5 years ago","https://www.youtube.com/watch?v=cgH69u-mPUI&lc=UgxEjlGiHXPGlW6SKRp4AaABAg","That was the politest I've ever seen Duncan tell any entrepreneurs that he's out.","8",""
"","https://www.youtube.com/@Anonymous-or4ru","@Anonymous-or4ru","6 years ago","https://www.youtube.com/watch?v=cgH69u-mPUI&lc=Ugyx4OjicBxrZaLTtch4AaABAg","HAHAHA, never have I seen such a weird vibe from all parties after agreeing on a deal","10",""
"https://yt3.ggpht.com/ytc/AIdro_l1tprOcronpNLJAKBTr843fDPoK7s5q8mLno6mTi_8yw=s88-c-k-c0x00ffffff-no-rj","https://www.youtube.com/@maybenah","@maybenah","5 years ago","https://www.youtube.com/watch?v=cgH69u-mPUI&lc=UgxJDpgE146J2quljZ14AaABAg","I wonder if jenny has ever read these comments and then just logged out","47","2 replies"
"https://yt3.ggpht.com/U6yyyy1g8nZA2PGSYozqyi-BT7xY4PkquBy5jZZ5ZIOLjI-5Q0yuTd92RvhXXeiiqdX-h7LbWw=s88-c-k-c0x00ffffff-no-rj","https://www.youtube.com/@yongslicer","@yongslicer","6 years ago","https://www.youtube.com/watch?v=cgH69u-mPUI&lc=Ugw3cyZZJs0aJmDwwi14AaABAg","Quite disappointing that the other dragons didn't try to negotiate the non-negotiable offer. Really pleased with Piers on this one, there's no harm to see if it's possible and he got a better deal.","48","3 replies"
"https://yt3.ggpht.com/ytc/AIdro_mDZYstJiKNUhwWETBaeIeyDirFDvKlsx6zvD-ldZLoOBA=s88-c-k-c0x00ffffff-no-rj","https://www.youtube.com/@-_Alyssia_-","@-_Alyssia_-","6 years ago","https://www.youtube.com/watch?v=cgH69u-mPUI&lc=UgxpvVpkpUxExB9xa1p4AaABAg","So I went to their site and the longest possible name I could rip them off with was 11 characters.","43","2 replies"
"https://yt3.ggpht.com/ytc/AIdro_lulGKEiiQOvY1UQ9mO0IiwyUHdQa1h18qs7pex6yg=s88-c-k-c0x00ffffff-no-rj","https://www.youtube.com/@JL-gf3yc","@JL-gf3yc","1 month ago","https://www.youtube.com/watch?v=cgH69u-mPUI&lc=UgzgwZp6DOhjlQjNlEh4AaABAg","The good old days when valuations were taken seriously by the investors","1",""
"https://yt3.ggpht.com/ytc/AIdro_nR5JKtPfhNq6CCwpMqRXzhlyzDtjvK8ztOtnTOSeDs3wM=s88-c-k-c0x00ffffff-no-rj","https://www.youtube.com/@allewis86","@allewis86","6 years ago (edited)","https://www.youtube.com/watch?v=cgH69u-mPUI&lc=UgwN5b1l4-H5Ud40QQB4AaABAg","I love watching old Dragon's Den episodes where the Dragon's are underwhelmed or pass on a product which turns out to be quite successful in today's market. I personally have bought these books for my two children and think they're absolutely brilliant and worth every penny. To answer your question Peter, yes, in 5 years time 100k for 4% COULD have gotten you a return.","320","23 replies"
"https://yt3.ggpht.com/ytc/AIdro_kD3BFCfff-sP6znFaVqABDceU7NIXzPuEioTQ04Qw=s88-c-k-c0x00ffffff-no-rj","https://www.youtube.com/@tiztisdale1784","@tiztisdale1784","6 years ago","https://www.youtube.com/watch?v=cgH69u-mPUI&lc=UgzYD_sC_axEN-ESYNN4AaABAg","""Hi Dragons, my name is ---""    Jenny: ""Hi. My name is Jenny. And for that reason, I'm out.""","35",""
"https://yt3.ggpht.com/r5jIoYrhFjR12QoRLZMywEWHXo3mWJFcYSAShc0D86Dt0fu44rqi89jl0Yqlwabgr94seEGhRdY=s88-c-k-c0x00ffffff-no-rj","https://www.youtube.com/@TomorrowWeLive","@TomorrowWeLive","6 years ago","https://www.youtube.com/watch?v=cgH69u-mPUI&lc=Ugx1sv9Yn-IAVA47su14AaABAg","I like that Deborah spoke up on their behalf. She's always been my favourite.","285","7 replies"
"https://yt3.ggpht.com/ytc/AIdro_kHlVjx23e9xVJc32qnWaQUUnvhIcJaTvj2MU_jzRT1d-PXR1_sjz20Zd9VUy4cCHsHIQ=s88-c-k-c0x00ffffff-no-rj","https://www.youtube.com/@mma4179","@mma4179","5 years ago","https://www.youtube.com/watch?v=cgH69u-mPUI&lc=UgwZQrP42bUfwfx90qh4AaABAg","One of the books had Jenny’s name, but the book was out of stock.","14",""
"https://yt3.ggpht.com/ytc/AIdro_klTI2praLNaqlzPG27min8riU6yJuEV7e_mNkfKVc=s88-c-k-c0x00ffffff-no-rj","https://www.youtube.com/@bobosmodernlife","@bobosmodernlife","5 years ago","https://www.youtube.com/watch?v=cgH69u-mPUI&lc=Ugz2NQctSTBaLIcvZ7l4AaABAg","Did the other investors accept the terms is the big question.","18",""
"https://yt3.ggpht.com/ytc/AIdro_lJiY89CGweOF5B9JQYkdx-SCrDiALjM3MOO2BJuGQ=s88-c-k-c0x00ffffff-no-rj","https://www.youtube.com/@riri6345","@riri6345","5 years ago (edited)","https://www.youtube.com/watch?v=cgH69u-mPUI&lc=Ugx98ncV0B9Uw3NverV4AaABAg","Jenny is obviously not there because she’s still out....","67",""
"https://yt3.ggpht.com/ytc/AIdro_lJ29A3bAm491UOekzrZpXoz8UNeImkxtKsmfnp-8s=s88-c-k-c0x00ffffff-no-rj","https://www.youtube.com/@bax442","@bax442","6 years ago","https://www.youtube.com/watch?v=cgH69u-mPUI&lc=UgwIenOZn-bD818eOl14AaABAg","Doubrah was wrong, pierse actually got 4% in the end. Company was a best selling book in 2018. Company is currently making over 9mln us dollars.","215","9 replies"
"https://yt3.ggpht.com/ytc/AIdro_mT5j0ryk5gtTukjzJXNHna4PI0WauhukDGrD0vO1uqJQ=s88-c-k-c0x00ffffff-no-rj","https://www.youtube.com/@MoonlapseVertigo23","@MoonlapseVertigo23","5 years ago","https://www.youtube.com/watch?v=cgH69u-mPUI&lc=Ugz3PCqjphFJp_rFgMh4AaABAg","When you've bought the book even before seeing this video","8",""
"https://yt3.ggpht.com/THvTWAF9DJLV1IQnJDyZXmHDxKzPZ8BSmhmnkRwFcjF_jIllF1tMB9tcZVb9_DY1O_xpYctFnA=s88-c-k-c0x00ffffff-no-rj","https://www.youtube.com/@ashleelmb","@ashleelmb","5 years ago","https://www.youtube.com/watch?v=cgH69u-mPUI&lc=UgxEjlGiHXPGlW6SKRp4AaABAg","That was the politest I've ever seen Duncan tell any entrepreneurs that he's out.","8",""
"https://yt3.ggpht.com/ytc/AIdro_nRTySUcH8jIA_XQDHr85_u53McJIyz-Ot20OYgkMcYwdM=s88-c-k-c0x00ffffff-no-rj","https://www.youtube.com/@Anonymous-or4ru","@Anonymous-or4ru","6 years ago","https://www.youtube.com/watch?v=cgH69u-mPUI&lc=Ugyx4OjicBxrZaLTtch4AaABAg","HAHAHA, never have I seen such a weird vibe from all parties after agreeing on a deal","10",""
"https://yt3.ggpht.com/ytc/AIdro_mbdw79JGc5mlEFb4L_fDS_eNfnZ3cB5TODqlDQLt_5YWQ-7_FLklstw7UB2tMe0YfK6w=s88-c-k-c0x00ffffff-no-rj","https://www.youtube.com/@Sidecontrol1234","@Sidecontrol1234","6 years ago","https://www.youtube.com/watch?v=cgH69u-mPUI&lc=UgzPDgJr32yhfz1ln6x4AaABAg","This was a success for both the Piers and the book guys, selling over 2 million copies world wide.  Pretty amazing punt!","9",""
"https://yt3.ggpht.com/ytc/AIdro_leb4U0Gz1mBgna_WCy59NBhFDJ9EZfUMepuVSmwBA=s88-c-k-c0x00ffffff-no-rj","https://www.youtube.com/@MrBlitzpunk","@MrBlitzpunk","5 years ago","https://www.youtube.com/watch?v=cgH69u-mPUI&lc=UgynE1Nk0jPFrugFPIJ4AaABAg","Kelly looks like she could teach fortune telling and chemistry in Hogwarts","9","2 replies"
"https://yt3.ggpht.com/ytc/AIdro_mD4x76qbdNXDTjk7L8EWq0CD9hcfVJAvWFeCGO-wWJYfiu=s88-c-k-c0x00ffffff-no-rj","https://www.youtube.com/@ivygoko","@ivygoko","6 years ago","https://www.youtube.com/watch?v=cgH69u-mPUI&lc=UgzYyKsT0g08tJABB1J4AaABAg","I might be addicted to this things","32","3 replies"
"https://yt3.ggpht.com/ytc/AIdro_knhQthcI1exizBExFgkzH5frSDMwFaj4UdEaaQk41cpg=s88-c-k-c0x00ffffff-no-rj","https://www.youtube.com/@Cakaholic365","@Cakaholic365","6 years ago","https://www.youtube.com/watch?v=cgH69u-mPUI&lc=UgyARuplfKNHjBRdkkd4AaABAg","Bought this book 3 years ago for my nephew. They’re brilliant. Highly recommend.","31","1 reply"
"https://yt3.ggpht.com/ytc/AIdro_k2wXqZ5ZLsUQarHW8vY_lMSjZsIae_pwYdofj95Z8Few=s88-c-k-c0x00ffffff-no-rj","https://www.youtube.com/@brendanquinn5804","@brendanquinn5804","5 years ago","https://www.youtube.com/watch?v=cgH69u-mPUI&lc=UgzQaCa0h4StzWiGOdp4AaABAg","Kelly looks so miserable. She must have lemon juice for blood.","7",""
"https://yt3.ggpht.com/hyYNEPJPR65Rwf5YGtVD2OCzYZ1IDZQEW1_VI7G-PIdOc92HENMOnrQf5PFeBnvQF1iePGRUUQ=s88-c-k-c0x00ffffff-no-rj","https://www.youtube.com/@stableianF1oracle","@stableianF1oracle","5 years ago","https://www.youtube.com/watch?v=cgH69u-mPUI&lc=UgzY8AjlOrZBMiLqEdx4AaABAg&pp=0gcJCSIANpG00pGi","Why is there 60 billion adverts in a short video. Pain in the arse","1",""
"https://yt3.ggpht.com/ytc/AIdro_n_9xL16AB_6yjy7_djI6H9FoX4WZtcQK-7BdvPonk=s88-c-k-c0x00ffffff-no-rj","https://www.youtube.com/@anml1969","@anml1969","6 years ago","https://www.youtube.com/watch?v=cgH69u-mPUI&lc=UgwZUrIyUkJVQ0bnYmx4AaABAg","Why didn’t they make a book for Jenny?  Oh, she’s out.","18",""
"https://yt3.ggpht.com/ytc/AIdro_mygYg4g20KQLPUfs4-LY-5UJgOCr1u8CZ9sAsk1bxMFN4=s88-c-k-c0x00ffffff-no-rj","https://www.youtube.com/@Picnicl","@Picnicl","5 years ago (edited)","https://www.youtube.com/watch?v=cgH69u-mPUI&lc=Ugxp2JndhpMjRX5BrxR4AaABAg","Peter's initial behaviour is suggestive of a man whose default is to find things passe. The fact he chooses to immediately express it is suggestive of a toddler's mind. This mixture of wordly arrogance and petulance is what you'd expect from a spoiled despot. He simply always seems too greedy for anyone else's own good. He's like a shark - you'll frequently see him humourlessly eying the pitcher with beady eyes before he does what he possibly thinks is a charming Cowell-like about-face by smiling. But the shark never shows you its gleaming grin until its jaws are eagerly waiting to devour you.","12",""
